{"cert_sha256":"sha256:27c1089f28a4673d4b348344f82850b65b4d8ef220dae9277b210df3a4dc09c0","command_tags":["compile_lp_loss_cover","firev_accept_and_settle"],"instance_hash":"sha256:194cf1e01b8ffe5016dc4404a2b9b466024a371921e1e0c9fefd05dd376a6d1b","ir_hash":"sha256:bf1509a7c86dfd9cd2d353133de9abf879f2fdf2279c4bd3114636233e8e7be4","kernel_ir_hash":"sha256:bf1509a7c86dfd9cd2d353133de9abf879f2fdf2279c4bd3114636233e8e7be4","kernel_model_id":"fire_lp_loss_cover_v1","kernel_ref_file_sha256":"sha256:8c96d58363d0f0d772ce41d83fd53acf953f73a5eea0a51f2d65bb894a58c635","kernel_ref_module":"src.fire.kernel.fire_lp_loss_cover_v1_ref","object_family":"capped_lp_loss_cover","object_hash":"sha256:10bfe51a55b6821ca73855e541b79f1e11a2f916cd1e75a5fbea72f8903a911b","object_id":"lp_loss_cover_v1","object_name":"LPLossCover","object_version":"v1","phase_symbols":["Idle","Compiled","Settled"],"schema":"zenodex/fire-kernel-receipt/v1"}